{
  "schema_url": "https://raw.githubusercontent.com/walidbi200/GameDoc/main/schema/gamedoc.v2.schema.json",
  "schema": "gamedoc.v2",
  "gamedoc_version": "0.2.0",
  "facts": [
    {
      "id": "system.architecture",
      "category": "system",
      "value": "x86_64",
      "confidence": "detected",
      "source": {
        "collector": "system",
        "method": {
          "type": "command",
          "target": "uname -m"
        }
      }
    },
    {
      "id": "system.cpu_governor",
      "category": "system",
      "value": "performance",
      "confidence": "detected",
      "source": {
        "collector": "system",
        "method": {
          "type": "file",
          "target": "/sys/devices/system/cpu/cpu0/cpufreq/scaling_governor"
        }
      }
    },
    {
      "id": "system.desktop",
      "category": "system",
      "value": "GNOME",
      "confidence": "detected",
      "source": {
        "collector": "system",
        "method": {
          "type": "environment",
          "target": "desktop environment"
        }
      }
    },
    {
      "id": "system.kernel_version",
      "category": "system",
      "value": "6.9.0-test",
      "confidence": "detected",
      "source": {
        "collector": "system",
        "method": {
          "type": "command",
          "target": "uname -r"
        }
      }
    },
    {
      "id": "system.session_type",
      "category": "system",
      "value": "wayland",
      "confidence": "detected",
      "source": {
        "collector": "system",
        "method": {
          "type": "environment",
          "target": "desktop session type"
        }
      }
    },
    {
      "id": "cpu.architecture",
      "category": "cpu",
      "value": "x86_64",
      "confidence": "detected",
      "source": {
        "collector": "cpu",
        "method": {
          "type": "command",
          "target": "uname -m"
        }
      }
    },
    {
      "id": "cpu.cores_logical",
      "category": "cpu",
      "value": 0,
      "confidence": "detected",
      "source": {
        "collector": "cpu",
        "method": {
          "type": "path",
          "target": "/sys/devices/system/cpu/"
        }
      }
    },
    {
      "id": "gpu.device",
      "category": "gpu",
      "value": "00:02.0 \"VGA compatible controller\" \"Example GPU\" \"Model 1\"",
      "confidence": "detected",
      "source": {
        "collector": "graphics",
        "method": {
          "type": "command",
          "target": "lspci -mm"
        }
      }
    },
    {
      "id": "gpu.opengl_renderer",
      "category": "gpu",
      "value": "Example Renderer",
      "confidence": "detected",
      "source": {
        "collector": "graphics",
        "method": {
          "type": "command",
          "target": "glxinfo -B"
        }
      }
    },
    {
      "id": "gpu.opengl_version",
      "category": "gpu",
      "value": "4.6 Mesa 24.1",
      "confidence": "detected",
      "source": {
        "collector": "graphics",
        "method": {
          "type": "command",
          "target": "glxinfo -B"
        }
      }
    },
    {
      "id": "gpu.vulkan_available",
      "category": "gpu",
      "value": true,
      "confidence": "detected",
      "source": {
        "collector": "graphics",
        "method": {
          "type": "command",
          "target": "vulkaninfo --summary"
        }
      }
    }
  ],
  "problems": [],
  "checks": [
    {
      "collector": "cpu",
      "operation": "read /proc/cpuinfo",
      "message": "failed to read /proc/cpuinfo: entity not found"
    },
    {
      "collector": "distro",
      "operation": "read /etc/os-release",
      "message": "failed to read /etc/os-release: entity not found"
    }
  ]
}
