{
  "schema_url": "https://raw.githubusercontent.com/walidbi200/GameDoc/main/schema/gamedoc.v2.schema.json",
  "schema": "gamedoc.v2",
  "gamedoc_version": "0.2.0",
  "facts": [
    {
      "id": "system.architecture",
      "category": "system",
      "value": "x86_64",
      "confidence": "detected",
      "source": {
        "collector": "system",
        "method": {
          "type": "command",
          "target": "uname -m"
        }
      }
    },
    {
      "id": "system.kernel_version",
      "category": "system",
      "value": "6.9.0-test",
      "confidence": "detected",
      "source": {
        "collector": "system",
        "method": {
          "type": "command",
          "target": "uname -r"
        }
      }
    },
    {
      "id": "cpu.architecture",
      "category": "cpu",
      "value": "x86_64",
      "confidence": "detected",
      "source": {
        "collector": "cpu",
        "method": {
          "type": "command",
          "target": "uname -m"
        }
      }
    },
    {
      "id": "cpu.cores_logical",
      "category": "cpu",
      "value": 0,
      "confidence": "detected",
      "source": {
        "collector": "cpu",
        "method": {
          "type": "path",
          "target": "/sys/devices/system/cpu/"
        }
      }
    },
    {
      "id": "gpu.vulkan_available",
      "category": "gpu",
      "value": false,
      "confidence": "detected",
      "source": {
        "collector": "graphics",
        "method": {
          "type": "command",
          "target": "vulkaninfo --summary"
        }
      }
    },
    {
      "id": "steam.data_readable",
      "category": "steam",
      "value": {
        "installation": "native",
        "readable": true
      },
      "confidence": "detected",
      "source": {
        "collector": "steam",
        "method": {
          "type": "path",
          "target": "native Steam data"
        }
      }
    },
    {
      "id": "steam.executable",
      "category": "steam",
      "value": true,
      "confidence": "detected",
      "source": {
        "collector": "steam",
        "method": {
          "type": "path",
          "target": "PATH:steam"
        }
      }
    },
    {
      "id": "steam.installation",
      "category": "steam",
      "value": "native",
      "confidence": "detected",
      "source": {
        "collector": "steam",
        "method": {
          "type": "path",
          "target": "native Steam executable"
        }
      }
    },
    {
      "id": "steam.library",
      "category": "steam",
      "value": {
        "index": 1,
        "installation": "native"
      },
      "confidence": "detected",
      "source": {
        "collector": "steam",
        "method": {
          "type": "file",
          "target": "native Steam library metadata"
        }
      }
    },
    {
      "id": "steam.library",
      "category": "steam",
      "value": {
        "index": 2,
        "installation": "native"
      },
      "confidence": "detected",
      "source": {
        "collector": "steam",
        "method": {
          "type": "file",
          "target": "native Steam library metadata"
        }
      }
    },
    {
      "id": "steam.library_readable",
      "category": "steam",
      "value": {
        "index": 1,
        "installation": "native",
        "readable": true
      },
      "confidence": "detected",
      "source": {
        "collector": "steam",
        "method": {
          "type": "path",
          "target": "Steam library"
        }
      }
    },
    {
      "id": "steam.library_readable",
      "category": "steam",
      "value": {
        "index": 2,
        "installation": "native",
        "readable": false
      },
      "confidence": "detected",
      "source": {
        "collector": "steam",
        "method": {
          "type": "path",
          "target": "Steam library"
        }
      }
    },
    {
      "id": "steam.proton_scan_complete",
      "category": "steam",
      "value": {
        "complete": false,
        "installation": "native"
      },
      "confidence": "detected",
      "source": {
        "collector": "steam",
        "method": {
          "type": "path",
          "target": "Steam common directory"
        }
      }
    }
  ],
  "problems": [
    {
      "id": "gpu.vulkan_unavailable",
      "category": "gpu",
      "severity": "critical",
      "summary": "Vulkan is not available",
      "details": [
        "The local Vulkan probe exited unsuccessfully."
      ],
      "recommendation": {
        "text": "Vulkan is not available.",
        "platform_specific": {
          "arch": "pacman -S vulkan-tools",
          "debian": "apt install vulkan-tools",
          "fedora": "dnf install vulkan-tools",
          "nixos": "configuration.nix: environment.systemPackages = [ pkgs.vulkan-tools ];",
          "ubuntu": "apt install vulkan-tools"
        },
        "difficulty": 1,
        "est_minutes": 1,
        "requires_root": true,
        "requires_reboot": false,
        "docs_url": "https://wiki.archlinux.org/title/Vulkan"
      }
    },
    {
      "id": "steam.library_unreadable",
      "category": "steam",
      "severity": "medium",
      "summary": "A Steam library could not be read",
      "details": [
        "1 Steam library location(s) could not be read."
      ],
      "recommendation": {
        "text": "A Steam library could not be read. Check filesystem permissions on the library mount.",
        "difficulty": 2,
        "est_minutes": 5,
        "requires_root": true,
        "requires_reboot": false
      }
    }
  ],
  "checks": [
    {
      "collector": "system",
      "operation": "read /sys/devices/system/cpu/cpu0/cpufreq/scaling_governor",
      "message": "failed to read /sys/devices/system/cpu/cpu0/cpufreq/scaling_governor: entity not found"
    },
    {
      "collector": "cpu",
      "operation": "read /proc/cpuinfo",
      "message": "failed to read /proc/cpuinfo: entity not found"
    },
    {
      "collector": "distro",
      "operation": "read /etc/os-release",
      "message": "failed to read /etc/os-release: entity not found"
    },
    {
      "collector": "graphics",
      "operation": "vulkaninfo --summary",
      "message": "command exited with status Some(1)"
    },
    {
      "collector": "steam",
      "operation": "native Steam common directory",
      "message": "Steam common directory could not be read"
    },
    {
      "collector": "steam",
      "operation": "native Steam library 2",
      "message": "Steam library could not be read"
    }
  ]
}
